{
  "$schema": "http://json-schema.org/draft-04/schema#",
  "title": "faction",
  "type": "object",
  "additionalProperties": false,
  "properties": {
    "id": {
      "type": "string"
    },
    "name": {
      "type": "string"
    },
    "culture": {
      "type": "string"
    },
    "era": {
      "type": "string"
    },
    "doctrine": {
      "type": "string"
    },
    "units": {
      "type": "array",
      "items": {
        "type": "string"
      }
    },
    "colors": {
      "type": "array",
      "items": {
        "type": "string"
      }
    }
  }
}
